{
  "id": "bxqs",
  "version": "1.0.0",
  "title": "Brand Experience Quality Score",
  "description": "A 100-point rubric of twelve dimensions. Every point comes from one of four evidence classes (automated check, expert assessment, observed behaviour, customer feedback). Automated and expert evidence together can earn at most the sum of weight x cap_without_observed_or_customer; the rest is reserved for observed or customer evidence. Unmeasured points count as zero and are shown. This file is IMMUTABLE once released: a change is a new version.",
  "released_at": "2026-10-23T00:00:00Z",
  "contributors": [
    {
      "id": "claude-sonnet-5-5",
      "kind": "ai",
      "display_name": "Claude Sonnet 5.5"
    }
  ],
  "policy": {
    "total_points": 100,
    "release_evidenced_minimum": 90,
    "build_verified_attainment_minimum": 90,
    "ai_only_expert_credit": 0.5,
    "expert_level_max": 4,
    "observed_minimum_n": 5,
    "disagreement_levels": 1,
    "confidence_minimum_weight": 50
  },
  "dimensions": [
    {
      "id": "emotional_clarity_positioning",
      "order": 1,
      "name": "Emotional clarity and positioning",
      "weight": 8,
      "description": "Whether the product states a clear purpose and audience and expresses the profile's INTENDED feelings through copy and behaviour. This dimension rates whether the intent is expressed; it never asserts that anyone feels it.",
      "measurable_without_observed_or_customer": true,
      "cap_without_observed_or_customer": 0.5,
      "floor": 0.5,
      "shares": {
        "automated_check": 0.15,
        "expert_assessment": 0.35,
        "observed_or_customer": 0.5
      },
      "evidence": {
        "automated_check": {
          "allowed": true,
          "checks": [
            {
              "id": "d1.copy_profile_language_lint",
              "measures": "Share of user-facing strings that avoid the resolved profile's banned phrases and stay inside its claims policy (1 = no violations).",
              "weight": 40
            },
            {
              "id": "d1.purpose_statement_present",
              "measures": "A purpose statement exists on the entry surface within length bounds and uses the profile's purpose terms (existence and term check only).",
              "weight": 30
            },
            {
              "id": "d1.product_md_consistency",
              "measures": "Entry-surface copy contains the audience and purpose terms declared in the product's PRODUCT.md and none of its listed contradictions.",
              "weight": 30
            }
          ]
        },
        "expert_assessment": {
          "allowed": true,
          "levels": [
            {
              "level": 0,
              "anchor": "No purpose or audience can be found on the entry surface, or what is shown contradicts the profile."
            },
            {
              "level": 1,
              "anchor": "A purpose can be inferred but is generic, and no behaviour of the interface reflects the profile's intended feelings."
            },
            {
              "level": 2,
              "anchor": "Purpose is stated; the profile's intended feelings are reflected on some screens or in some copy but not in the main flow."
            },
            {
              "level": 3,
              "anchor": "Purpose and audience are clear on the entry surface and the main flow reflects the intended feelings, with minor inconsistencies."
            },
            {
              "level": 4,
              "anchor": "Purpose, audience and the intended feelings are expressed consistently through copy and behaviour in every main flow, and nothing contradicts the profile."
            }
          ]
        },
        "observed_behaviour": {
          "allowed": true,
          "metrics": [
            {
              "id": "first_screen_purpose_comprehension",
              "measures": "Share of participants whose own words state the product's purpose after the first screen, matching the declared purpose (coded by a person).",
              "weight": 40
            }
          ]
        },
        "customer_feedback": {
          "allowed": true,
          "metrics": [
            {
              "id": "described_feeling_matches_intent",
              "measures": "Share of participants whose own words for the experience include any of the profile's intended feelings (coded by a person; the profile's feelings stay \"intended\" until this exists).",
              "weight": 60
            }
          ]
        }
      }
    },
    {
      "id": "brand_distinctiveness",
      "order": 2,
      "name": "Brand distinctiveness",
      "weight": 7,
      "description": "Whether the product has an identity of its own rather than a generic template look, within the shared principles the ecosystem profile sets. Distinct does not mean different from the other Dot products: platforms keep their own functional identities.",
      "measurable_without_observed_or_customer": true,
      "cap_without_observed_or_customer": 0.6,
      "floor": 0.5,
      "shares": {
        "automated_check": 0.25,
        "expert_assessment": 0.35,
        "observed_or_customer": 0.4
      },
      "evidence": {
        "automated_check": {
          "allowed": true,
          "checks": [
            {
              "id": "d2.impeccable_detect_findings",
              "measures": "`impeccable detect` findings in the identity categories (typography, colour, layout templates) on the shipped UI, scaled so that 1 = no findings and 0 = findings at or above the configured ceiling.",
              "weight": 40
            },
            {
              "id": "d2.font_palette_deny_list",
              "measures": "Share of fonts and palette values that are not on the deny-list of generic defaults held by the profile and the design skill.",
              "weight": 30
            },
            {
              "id": "d2.token_uniqueness",
              "measures": "Share of design tokens whose values differ from the framework or template defaults.",
              "weight": 30
            }
          ]
        },
        "expert_assessment": {
          "allowed": true,
          "levels": [
            {
              "level": 0,
              "anchor": "The interface is indistinguishable from a framework default or template."
            },
            {
              "level": 1,
              "anchor": "A few customisations exist but typography, colour and layout are default or interchangeable with other products."
            },
            {
              "level": 2,
              "anchor": "Some deliberate choices are visible but they are not applied consistently across the main screens."
            },
            {
              "level": 3,
              "anchor": "A deliberate, consistent identity is visible across the main screens, with minor generic areas."
            },
            {
              "level": 4,
              "anchor": "A deliberate identity is consistent across every main screen, is recorded in the product's DESIGN.md, and every choice traces to the profile or a written reason."
            }
          ]
        },
        "observed_behaviour": {
          "allowed": true,
          "metrics": [
            {
              "id": "unlabelled_screen_attribution",
              "measures": "Share of participants who attribute an unlabelled screen to the correct product when shown it among alternatives.",
              "weight": 50
            }
          ]
        },
        "customer_feedback": {
          "allowed": true,
          "metrics": [
            {
              "id": "distinctiveness_rating",
              "measures": "Participants' own rating of how much the product looks and reads like itself, normalised to 0 to 1.",
              "weight": 50
            }
          ]
        }
      }
    },
    {
      "id": "usability_cognitive_load",
      "order": 3,
      "name": "Usability and cognitive load",
      "weight": 12,
      "description": "How directly a person can complete the product's main tasks, and how much the interface asks them to hold in mind while they do.",
      "measurable_without_observed_or_customer": true,
      "cap_without_observed_or_customer": 0.6,
      "floor": 0.6,
      "shares": {
        "automated_check": 0.3,
        "expert_assessment": 0.3,
        "observed_or_customer": 0.4
      },
      "evidence": {
        "automated_check": {
          "allowed": true,
          "checks": [
            {
              "id": "d3.nav_depth",
              "measures": "Steps from the entry point to each primary destination against the bound set in the profile or product (1 = all within bound).",
              "weight": 20
            },
            {
              "id": "d3.field_counts",
              "measures": "Share of forms whose field count is within the bound and which ask for nothing the task does not need.",
              "weight": 20
            },
            {
              "id": "d3.heading_structure",
              "measures": "Share of screens with exactly one level-one heading and no skipped heading levels.",
              "weight": 15
            },
            {
              "id": "d3.primary_action_per_screen",
              "measures": "Share of screens with exactly one visually primary action.",
              "weight": 20
            },
            {
              "id": "d3.task_flow_step_counts",
              "measures": "Share of scripted task flows that complete within their declared step budget.",
              "weight": 25
            }
          ]
        },
        "expert_assessment": {
          "allowed": true,
          "levels": [
            {
              "level": 0,
              "anchor": "A main task cannot be completed, or the interface actively obstructs it."
            },
            {
              "level": 1,